{
  "schema_version": "1.0.0",
  "project_id": "dry-run-002",
  "created_at": "2026-09-22T14:20:30Z",
  "product_id": "dry-run-002-lumiflex-ficticio",
  "hypothesis": "Hipótese inicial de teste estrutural, não baseada em dado real: um hook de dor ('sua mesa ainda tem luz ruim?') gera melhor retenção do que um hook de demonstração direta para esta categoria fictícia de produto.",
  "variable": "hook",
  "variable_reason": "Primeiro experimento do produto (fictício) — nenhum experimento anterior existe, então a dimensão escolhida é a mais barata de testar primeiro (hook), não uma decisão baseada em aprendizado prévio.",
  "variants": [
    {
      "variant_id": "variant-a-pain-hook",
      "description": "Hook de dor: 'Sua mesa ainda tem aquela luz horrível?' (o vídeo produzido neste dry-run).",
      "video_id": "asset-01",
      "publication_id": "SIMULATED-post-id-999222",
      "metrics_id": "dry-run-002/metrics.json"
    }
  ],
  "status": "analyzed",
  "analysis": {
    "winning_variant_id": null,
    "confidence": "insufficient_data",
    "evidence_basis": "SIMULATED. Apenas 1 variante tem vídeo/publicação/métrica neste dry-run — não há nada para comparar ainda. performance-analysis-agent corretamente não declara vencedor com uma única variante; isso é o comportamento esperado, não um bug da simulação.",
    "learning": "Nenhum aprendizado extraível ainda — este experimento precisa de ao menos uma segunda variante (mesma dimensão 'hook', tudo mais igual) publicada e com métricas coletadas antes de qualquer comparação.",
    "suggested_next_experiment": "Ver experiment-002-proposal.json — proposta do creative-iteration-agent para uma segunda variante de hook."
  },
  "simulation_note": "SIMULATED — NOT REAL — NO EXTERNAL API CALL"
}
